{
  "$schema": "../../../../schemas/team.schema.json",
  "deployments": [
    {
      "capacity": 1,
      "sku": "DataZoneStandard",
      "slug": "gpt-5-nano",
      "status": "active"
    }
  ],
  "environment": "infradev",
  "gateway": {
    "allowedDeployments": [
      "gpt-5-nano"
    ],
    "credentialType": "oauth",
    "limits": {
      "requestsPerMinute": 60,
      "tokensPerMinute": 1000
    }
  },
  "oauth": {
    "externalClients": [],
    "federations": [],
    "secretsAllowed": true
  },
  "operationId": "000000000000000000000001",
  "revision": 1,
  "schemaVersion": 1,
  "status": "active",
  "team": {
    "serviceCode": "ZZZ",
    "slug": "alpha"
  },
  "updatedAt": "2026-10-13T00:00:00.000Z",
  "updatedBy": "entra:00000000-0000-0000-0000-000000000001"
}
